<?xml version="1.0" encoding="UTF-8"?>
<!--Created by Irakli Gzirishvili 28-10-2021-->
<!DOCTYPE table SYSTEM "http://web.magti.ge/pda/defines/xml/table.dtd">
<table name="lib_apis" history="yes">
	<columns>
		<column name="id" type="number" null="n" />
		<column name="lib_title" type="varchar2" length="500" Ti="1" />
		<column name="lib_desc" type="varchar2" length="4000" />
		<column name="active" type="number" null="n" default="1 " />
		<column name="ordering" type="number" null="n" default="999" />
		<column name="client_id" type="number" default="00" />

		<column name="apiid" type="varchar2" length="4000" />
		<column name="apikey" type="varchar2" length="4000" />
		<column name="apitime" type="number" default="5" />
		<column name="change_user" type="number" default="00" />
		<column name="change_date"  type="date" />
		
		<column name="api_tables0" type="varchar2" length="4000" />
		<column name="api_tables1" type="varchar2" length="4000" />
		<column name="api_tables2" type="varchar2" length="4000" />
		<column name="api_tables3" type="varchar2" length="4000" />
		<column name="api_tables4" type="varchar2" length="4000" />
		<column name="api_tables5" type="varchar2" length="4000" />
		<column name="api_tables6" type="varchar2" length="4000" />
		<column name="api_tables7" type="varchar2" length="4000" />
		<column name="api_tables8" type="varchar2" length="4000" />
		<column name="api_tables9" type="varchar2" length="4000" />
		<column name="api_tables10" type="varchar2" length="4000" />
	        <column name="modify_user" type="number" />
                <column name="modify_date" type="date" />
     	</columns>
	<sequence  name="sqs_apis" />
</table>
