<?xml version="1.0" encoding="UTF-8"?>
<!DOCTYPE table SYSTEM "http://web.magti.ge/pda/defines/xml/table.dtd">
<table name="lib_benefits_fines" history="yes">
	<columns>
		<column name="id" type="number" null="n"/>
		<column name="lib_title" type="varchar2" length="500"/>
		<column name="lib_desc" type="varchar2" length="4000"/>
		<column name="files" type="varchar2" length="4000"  />
		<column name="active" type="number" null="n" default="1 "/>
		<column name="ordering" type="number" null="n" default="999"/>
		<column name="client_id" type="number" default="00"/>
		<column name="must" type="number" />
		<column name="worker" type="varchar2" length="500" />
	     <column name="modify_user" type="number" />
          <column name="modify_date" type="date" />
     </columns>
	<history>
		<column name="lib_title" type="varchar2" length="500"/>
		<column name="lib_desc" type="varchar2" length="4000"/>
		<column name="files" type="varchar2" length="4000"  />
		<column name="active" type="number" null="n" default="1 "/>
		<column name="ordering" type="number" null="n" default="999"/>
		<column name="client_id" type="number" default="00"/>
		<column name="must" type="number" />
		<column name="worker" type="varchar2" length="500" />
	     <column name="modify_user" type="number" />
          <column name="modify_date" type="date" />
     </history>
	<sequence name="sqs_benefits_fines"/>
	<histsequence  name="sqs_benefits_fines_hist" />
</table>